MCQ,Choices,Correct
What is the scientific study of life called?,a: Chemistry | b: Biology | c: Physics | d: Geology,b
What is the main theme that explains the unity and diversity of life?,a: Evolution | b: Photosynthesis | c: Respiration | d: Mitosis,a
"What allows organisms to move, grow, and reproduce?",a: Photosynthesis | b: Energy processing | c: Cell division | d: Mitosis,b
What is the basic unit of life that processes hereditary information?,a: Atoms | b: Molecules | c: Cells | d: Tissues,c
When did life on Earth emerge?,a: 1 billion years ago | b: 2 billion years ago | c: 3.7 billion years ago | d: 5 billion years ago,c
